{
  "schema_version": "1.0",
  "request_id": "fixture-valid",
  "target": {
    "symbol": "mlk_poly_sub",
    "source_file": "mlkem/poly.c"
  },
  "queries": [
    {
      "id": "subtraction",
      "text": "polynomial subtraction",
      "mode": "all_terms",
      "required": true
    },
    {
      "id": "modulus",
      "text": "3329",
      "mode": "literal",
      "required": true
    }
  ],
  "options": {
    "case_sensitive": false,
    "context_lines": 1,
    "max_matches_per_query": 10
  }
}
